{"$schema":"./challenger-replacement-binance-golden-fixture-manifest-v1.schema.json","authority":{"account_requests":0,"broker_requests":0,"credentials_used":false,"network_requests":0,"orders_submitted_to_venue":0,"production_activation":false,"production_state_writes":0,"real_orders_allowed":false,"replacement_start_authorized":false,"runtime_install_authorized":false},"build_identity":{"build_input_tree_hash":"7777777777777777777777777777777777777777777777777777777777777777","manifest_file_sha256":"9999999999999999999999999999999999999999999999999999999999999999","manifest_hash":"8888888888888888888888888888888888888888888888888888888888888888","manifest_version":"1.66.0","package_version":"0.72.0","peeled_commit":"9999999999999999999999999999999999999999","release_tag":"v0.72.0-fixture"},"evidence_qualification":"COMMITTED_FIXTURE_NOT_LIVE_MARKET_OR_ACCOUNT","inventory":[{"kind":"INPUT","ordinal":1,"path":"spot-cycle/01-input.json","sha256":"54d9b9e38d44bf5095de18ff33923eae14dadd7ce98b4083ab33f749695b2829","size":6318,"stream":"spot-cycle"},{"kind":"RESULT","ordinal":2,"path":"spot-cycle/02-result.json","sha256":"c4b7125581f1b40bbbd7622cf2b358a91aaf42cbd05131c664b660345437cce2","size":10547,"stream":"spot-cycle"},{"kind":"INPUT","ordinal":3,"path":"spot-cycle/03-input.json","sha256":"4112395cc11243776f99b922d655cd63332604331633ef92e50caa16d98a6395","size":6318,"stream":"spot-cycle"},{"kind":"RESULT","ordinal":4,"path":"spot-cycle/04-result.json","sha256":"20eb87ba689cd15df605360ddb13edccb7d162c0e72524381c9c51c671bc876a","size":7405,"stream":"spot-cycle"},{"kind":"INPUT","ordinal":5,"path":"spot-cycle/05-input.json","sha256":"766be923f8ef008a2886c9715098ea9ba6e7f9a80aab376e51ae2418ae78e087","size":6318,"stream":"spot-cycle"},{"kind":"RESULT","ordinal":6,"path":"spot-cycle/06-result.json","sha256":"a2db0cd29b1988aa37655435d0c0fd157ee6a47023b555624567c1c7708bac2d","size":10578,"stream":"spot-cycle"},{"kind":"INPUT","ordinal":7,"path":"perp-cycle/01-input.json","sha256":"c67ebff556b4ab519eee51287c92e1975ce79442f0660e8b68cc5d113523987a","size":6318,"stream":"perp-cycle"},{"kind":"RESULT","ordinal":8,"path":"perp-cycle/02-result.json","sha256":"fb5f47c8364ae4aa14d5472e015a2890b71795acac27596d622c17c51c3b9b5b","size":10528,"stream":"perp-cycle"},{"kind":"INPUT","ordinal":9,"path":"perp-cycle/03-input.json","sha256":"849eb8d9b4f46403f2be560e4836b29f4e8109fe9443afab2e1b293b56326e67","size":6318,"stream":"perp-cycle"},{"kind":"RESULT","ordinal":10,"path":"perp-cycle/04-result.json","sha256":"aefdcfb3d271a0992798244f0ce84efedf0c7f7d43b4b4ddf299acf3f8a523e6","size":7400,"stream":"perp-cycle"},{"kind":"INPUT","ordinal":11,"path":"perp-cycle/05-input.json","sha256":"9a225f938519899f1ea6bb38e5e6d0c5c11d0912b7c4d592cb910da4dd410458","size":6344,"stream":"perp-cycle"},{"kind":"RESULT","ordinal":12,"path":"perp-cycle/06-result.json","sha256":"ce00f65d83b4e17d2fefd79d7bf9dd06eb6f10a4624afb1d3b2c05c64b1f4207","size":7402,"stream":"perp-cycle"},{"kind":"INPUT","ordinal":13,"path":"perp-cycle/07-input.json","sha256":"1537e315be7fa0ca907a5fcfe44f7ac8dbec52d4bc143e3b00b7ba69bdd31ef2","size":6318,"stream":"perp-cycle"},{"kind":"RESULT","ordinal":14,"path":"perp-cycle/08-result.json","sha256":"6592184c007623eaccda333f6261a7ce98ad44f1ae0b182c2d6526d8bee3e4d0","size":10603,"stream":"perp-cycle"}],"manifest_hash":"6977acff468689aeba64f1d814842c77ffa394f28bf686fdc82d02f5b61efbb4","manifest_id":"challenger_replacement_binance_golden_fixture_manifest_b2ce1d97bd41c812a5f58907602519da7df8d4543e33298389f0e5232e5c1821","plan":{"plan_hash":"f29474a1700b0c3cf313047e2d6e85182e68104d9584ec9df7b492aa7ab00486","plan_id":"challenger_replacement_plan_v3_e1b6a4187cb4bb4b371ea503f83284056d4f0c6c504feb7827971869a52f666f"},"schema_version":"1.0.0","simulation_contract":{"contract_hash":"b21beb877101590aabcc65927539d58eb001c4dc5de89ead0306ac840450f501","contract_id":"challenger_replacement_simulation_contract_c95cee71f23e58cf40bc4739e5063824de1a77fd5c6fcc72794ff42e1f84f791"}}